{
  "format": "csm-autoresearch-policy/1",
  "mode": "hill-climb",
  "hardGates": [{ "id": "valid", "kind": "valid" }],
  "population": { "enabled": true, "activateAfterStagnantTrials": 2, "maxArchive": 2 },
  "execution": {
    "network": "disabled",
    "credentials": "none",
    "evaluatorAssets": "isolated",
    "isolation": "trusted-in-process"
  }
}
